{
  "$schema": "./schemas/tokens.schema.json",
  "version": "1.0.0",
  "color": {
    "background": "oklch(0.985 0.004 255)",
    "surface": "oklch(1 0 0)",
    "surfaceMuted": "oklch(0.965 0.006 255)",
    "text": "oklch(0.25 0.02 255)",
    "textMuted": "oklch(0.52 0.02 255)",
    "border": "oklch(0.9 0.01 255)",
    "accent": "#0d0bb6",
    "accentSoft": "oklch(0.94 0.035 265.9)",
    "success": "oklch(0.50 0.13 155)",
    "warning": "oklch(0.52 0.14 80)",
    "danger": "oklch(0.54 0.2 25)",
    "focus": "oklch(0.65 0.18 265.9)"
  },
  "space": {
    "1": "4px",
    "2": "8px",
    "3": "12px",
    "4": "16px",
    "6": "24px",
    "8": "32px",
    "12": "48px"
  },
  "radius": {
    "base": "8px",
    "pill": "999px",
    "circle": "50%"
  },
  "shadow": {
    "none": "none",
    "raised": "0 1px 2px -1px oklch(0 0 0 / 0.08), 0 2px 4px oklch(0 0 0 / 0.06)",
    "dragging": "0 6px 16px -6px oklch(0 0 0 / 0.18), 0 3px 6px -3px oklch(0 0 0 / 0.1)",
    "overlay": "0 8px 24px -8px oklch(0 0 0 / 0.18), 0 4px 8px -4px oklch(0 0 0 / 0.08)",
    "floating": "0 16px 40px -12px oklch(0 0 0 / 0.22), 0 8px 16px -8px oklch(0 0 0 / 0.1)"
  },
  "content": {
    "maxWidth": "1200px",
    "readingWidth": "720px"
  },
  "type": {
    "body": "16px",
    "small": "14px",
    "label": "14px",
    "heading": "20px",
    "title": "32px",
    "lineHeightBody": "1.6",
    "lineHeightHeading": "1.25"
  }
}
